{
  "title": "फरशा आणि दोरी वापरून भिंतींमधलं अंतर मोजणे",
  "props": ["पट्टी", "दोरी", "फरशी"],
  "ideasets": ["मापन"],
  "board": "महाराष्ट्र राज्य मंडळ",
  "standard": 4,
  "subject": "गणित",
  "categories": ["वर्गातील प्रयोग"],
  "concepts": ["अंतर", "लांबी", "एकक" ,"रूपांतर", "मापन"],
  "images": ["1.jpg","2.jpg"],
  "rating": {
    "relevance": 5,
    "experience": 4,
    "resources": 5
  }
}
