{
  "title": "पट्टीने सेमी-मिमी मापन आणि काडी-दोरीची जुळणी",
  "props": ["पट्टी", "काड्या", "दोरी"],
  "ideasets": ["मापन"],
  "board": "महाराष्ट्र राज्य मंडळ",
  "standard": 4,
  "subject": "गणित",
  "categories": ["वर्गातील प्रयोग", "गट-उपक्रम"],
  "concepts": ["मापन", "तुलना"],
  "images": ["1.jpg"],
  "rating": {
    "relevance": 4,
    "experience": 5,
    "resources": 5
  }
}
