{
  "title": "पिशवी, मीठ आणि पोहे वापरून वस्तुमान मापन आणि तुलना",
  "props": ["पिशवी", "मीठ", "पोहे","पट्टी"],
  "ideasets": ["मापन"],
  "board": "महाराष्ट्र राज्य मंडळ",
  "standard": 4,
  "subject": "गणित",
  "categories": ["वर्गातील प्रयोग"],
  "concepts": ["वस्तुमान", "मापन", "एकक", "तुलना"],
  "images": ["1.jpg"],
  "rating": {
    "relevance": 4,
    "experience": 4,
    "resources": 5
  }
}
