{
  "title": "दिवाळीच्या फराळातून चित्रालेखाचे प्रमाण",
  "props": ["फळा", "खडू"],
  "ideasets": ["चित्रालेख"],
  "board": "महाराष्ट्र राज्य मंडळ",
  "standard": 4,
  "subject": "गणित",
  "categories": ["वर्गातील प्रयोग"],
  "concepts": ["चित्रालेख", "प्रमाण", "संकलन" ,"वर्गीकरण"],
  "images": ["1.jpg"],
  "rating": {
    "relevance": 5,
    "experience": 5,
    "resources": 5
  }
}
