{
  "title": "पाण्याचा ग्लास आणि बाटली वापरून आकारमानाची ओळख",
  "props": ["पाणी", "बाटली", "ग्लास"],
  "ideasets": ["मापन"],
  "board": "महाराष्ट्र राज्य मंडळ",
  "standard": 4,
  "subject": "गणित",
  "categories": ["वर्गातील प्रयोग"],
  "concepts": ["आकारमान", "मापन", "एकके","रूपांतर"],
  "images": [],
  "rating": {
    "relevance": 5,
    "experience": 4,
    "resources": 5
  }
}
