{
  "title": "तेलाची बाटली - आकारमान आणि वस्तुमान",
  "props": ["बाटली"],
  "ideasets": ["मापन"],
  "board": "महाराष्ट्र राज्य मंडळ",
  "standard": 4,
  "subject": "गणित",
  "categories": ["वर्गातील प्रयोग"],
  "concepts": ["आकारमान", "वस्तुमान", "धारणक्षमता", "फरक","मापन"],
  "images": ["1.jpg"],
  "rating": {
    "relevance": 5,
    "experience": 4,
    "resources": 5
  }
}
