{
  "title": "झाकणांच्या खेळातून चित्रालेखाची ओळख",
  "props": ["पिशवी", "बुच","झाकण"],
  "ideasets": ["चित्रालेख"],
  "board": "महाराष्ट्र राज्य मंडळ",
  "standard": 4,
  "subject": "गणित",
  "categories": ["वर्गातील प्रयोग"],
  "concepts": ["चित्रालेख", "संकलन", "वर्गीकरण"],
  "images": ["1.jpg"],
  "rating": {
    "relevance": 4,
    "experience": 5,
    "resources": 4
  }
}
