{
  "title": "पाणी मोजण्यासाठी कप, पेला व बाटली — आकारमानाची ओळख",
  "props": ["कप", "पेला", "बाटली", "पाणी", "बादली", "पिशवी", "वही", "पट्टी", "बटाटा", "तराजू"],
  "ideasets": ["आकारमानाची ओळख", "प्रवाही पदार्थांचे मापन"],
  "board": "महाराष्ट्र राज्य मंडळ",
  "standard": 4,
  "subject": "गणित",
  "categories": ["वर्गातील प्रयोग"],
  "concepts": ["आकारमान", "मापन", "एकक", "तुलना"],
  "images": ["1.jpg"],
  "rating": {
    "relevance": 4,
    "experience": 4,
    "resources": 5
  }
}
